{
  "schema_version": "1.0",
  "record_type": "RESEARCH_EVENT",
  "id": "RM-2026-002",
  "title": "Layered latent-state formalization and nonlinear star-system architecture",
  "significance": "R3",
  "event_type": "THEORY",
  "captured_at": "2026-10-22T22:00:00+08:00",
  "status": "ACTIVE",
  "source_repository": {
    "name": "15937-ass/ziwei-state-space",
    "ref": "main",
    "commit_sha": "f6944c896efd8f215d4e7d9d89f9fa4db84759f6"
  },
  "research_question": "How can source-language Zhongzhou knowledge be represented without collapsing star properties, relational effects, palace context, valence and observable events into one label?",
  "before_state": "A flat star-to-event label system or simple additive score would conflate state properties with context-dependent outcomes and fail to represent source conditions and provenance.",
  "result": "The accepted project model separates source wording from normalization, latent-state change from valence, star cores from star-system interactions, palace projection from latent state, and natal structure from temporal inputs.",
  "key_insights": [
    "The project uses a layered L0-L4 ontology as a revisable research representation.",
    "Fourteen major-star cores are base states, not complete chart interpretations.",
    "Sixty basic star systems allow interaction deltas, principal/multi-mode representations and context gates rather than simple vector addition.",
    "Twelve palaces are local nodes within a global sparse relation graph.",
    "The Paper 1 model prioritizes fixed natal essence plus exogenous temporal inputs and state-dependent response; full recursive dynamics and control claims remain future work."
  ],
  "negative_findings": [
    "A flat positive/negative score or fixed linear sum is not an adequate general representation under the current source-grounded design.",
    "Candidate ontology dimensions and interaction functions remain revisable; architectural approval does not freeze every candidate dimension."
  ],
  "unexpected_findings": [],
  "claim_effects": {
    "supported": [
      "CL-001",
      "CL-002",
      "CL-003"
    ],
    "weakened": [],
    "superseded": [],
    "opened": [
      "CL-004"
    ]
  },
  "boundaries": {
    "source_status": "The layered model is a research normalization constrained by source material; modern layer labels are not presented as classical wording.",
    "implementation_status": "Architecture specified and partly represented in project artifacts; not equivalent to complete corpus closure.",
    "internal_fidelity": "The event does not certify all rules or all textbook cases as validated.",
    "empirical_status": "No external prediction evidence is established.",
    "causal_status": "No causal claim."
  },
  "paper_targets": [
    "Paper 1 Corpus and Knowledge Formalization",
    "Paper 1 Formal Model",
    "Paper 1 Implementation",
    "Paper 1 Evaluation"
  ],
  "artifacts": [
    {
      "label": "Project Constitution",
      "url": "https://github.com/15937-ass/ziwei-state-space/blob/main/PROJECT_CONSTITUTION.md",
      "authority_status": "ACCEPTED_MAIN",
      "repository_path": "PROJECT_CONSTITUTION.md",
      "blob_sha": "eadad9e01cd85fbf1bcee48240b7e688ffe7012c"
    },
    {
      "label": "Decision Log",
      "url": "https://github.com/15937-ass/ziwei-state-space/blob/main/DECISION_LOG.md",
      "authority_status": "ACCEPTED_MAIN",
      "repository_path": "DECISION_LOG.md",
      "blob_sha": "183423d9ec507625dc7eb344573ccbdfd75f0f9d"
    },
    {
      "label": "Accepted chat theory/design/philosophy archive",
      "url": "https://github.com/15937-ass/ziwei-state-space/blob/main/governance/archive/2026-10-21-chat-theory-design-philosophy-preservation.md",
      "authority_status": "ACCEPTED_MAIN",
      "repository_path": "governance/archive/2026-10-21-chat-theory-design-philosophy-preservation.md",
      "blob_sha": "b2bc548831da43ccfe2575764a0bed200ca2d3b8"
    }
  ],
  "authority_notes": "The event is a synthesis of accepted project architecture. The term 'canonical method boundary' refers to project design, not canonical Zhongzhou doctrine.",
  "supersedes": [],
  "superseded_by": []
}
