{
  "schema_version": "1.0",
  "record_type": "RESEARCH_EVENT",
  "id": "RM-2026-010",
  "title": "P01 closes 21 registered source gaps on printed pages 5–9 without adding shared semantics",
  "significance": "R2",
  "event_type": "KNOWLEDGE",
  "captured_at": "2026-10-22T22:00:00+08:00",
  "status": "ACTIVE",
  "source_repository": {
    "name": "15937-ass/ziwei-state-space",
    "ref": "main",
    "commit_sha": "9735cd7a78a3c0addcf93aad1730d775e691be40"
  },
  "research_question": "Can the registered P01 source gaps on printed pages 5–9 be closed through source-first supplements while preserving time scope, conditional branches and the boundary between reusable rules and case-only support?",
  "before_state": "The P01 Life source-gap ledger contained 21 registered gaps from prior source-readjudication summaries, with a risk of duplicating already covered rules or narrowing source time expressions into an unsupported single layer.",
  "result": "The accepted P01 supplement closes all 21 registered gap IDs: 20 are closed by new source-first supplement records and GAP-021 is confirmed already covered by canonical P02-200. It adds 77 atomic supplemental records (64 reusable structural/state/timing/constraint records and 13 CASE_SUPPORT_ONLY records). Cumulative P01 canonical records after merge are 277, comprising 213 reusable projection rules and 64 case-support-only records. The summary reports no new shared semantic primitive, memory type, independent time scale, numeric weight, probability or decay.",
  "key_insights": [
    "Source gap IDs may bundle multiple independent source relations; the supplement atomizes pivots and conditional branches rather than forcing one record per gap.",
    "The source's time expressions are preserved: explicit 大限/流年 dual-layer wording remains dual-layer, while generic 人生枢纽/命运枢纽 is not silently narrowed to 大限.",
    "Condition-gated star-system branches remain distinct; for example, 武杀 本宫见煞忌 and 本宫外见煞忌 are not collapsed into a single valence score.",
    "The existing P02-200 coverage for GAP-021 is reused instead of duplicated.",
    "Case-specific historical claims remain CASE_SUPPORT_ONLY rather than being promoted to reusable canonical rules."
  ],
  "negative_findings": [
    "13 of the 77 supplemental records are CASE_SUPPORT_ONLY, not reusable projection rules.",
    "No new shared semantic primitive, memory type, independent time scale, numeric weight, probability or decay was introduced.",
    "The supplement resolves the 21 registered gap IDs; it does not claim every possible claim on printed pp5-9 has been independently re-extracted beyond those registered gaps."
  ],
  "unexpected_findings": [
    "One registered P01 gap was already covered by canonical P02-200, so the correct action was to close the gap reference without creating duplicate rule content."
  ],
  "claim_effects": {
    "supported": [
      "CL-012"
    ],
    "weakened": [],
    "superseded": [],
    "opened": [
      "CL-012"
    ]
  },
  "boundaries": {
    "source_status": "The accepted source-gap summary, closure ledger and time-scope artifact are explicit on main.",
    "implementation_status": "77 supplemental records are accepted in the Knowledge lane; this does not close the entire P01 corpus or authorize Product runtime changes.",
    "internal_fidelity": "Merged PR #577 reports final-head full pytest, syntax, P0 audit and governance validation passed; this Sidecar task did not rerun those checks.",
    "empirical_status": "No empirical prediction result.",
    "causal_status": "No causal claim."
  },
  "paper_targets": [],
  "artifacts": [
    {
      "label": "P01 Life source-gap summary, printed pp5-9",
      "url": "https://github.com/15937-ass/ziwei-state-space/blob/9735cd7a78a3c0addcf93aad1730d775e691be40/knowledge/palaces/P01_life/wp05/LIFE_SOURCE_GAP_SUMMARY_PP5_9_v0.1.json",
      "authority_status": "ACCEPTED_MAIN",
      "repository_path": "knowledge/palaces/P01_life/wp05/LIFE_SOURCE_GAP_SUMMARY_PP5_9_v0.1.json",
      "blob_sha": "d3e321f7717a309ad3c61f293f832b533604e96c"
    },
    {
      "label": "P01 Life source-gap closure ledger, printed pp5-9",
      "url": "https://github.com/15937-ass/ziwei-state-space/blob/9735cd7a78a3c0addcf93aad1730d775e691be40/knowledge/palaces/P01_life/wp05/LIFE_SOURCE_GAP_CLOSURE_LEDGER_PP5_9_v0.1.json",
      "authority_status": "ACCEPTED_MAIN",
      "repository_path": "knowledge/palaces/P01_life/wp05/LIFE_SOURCE_GAP_CLOSURE_LEDGER_PP5_9_v0.1.json",
      "blob_sha": "e2803555babef4264c9ef8223ced2349fda632d6"
    },
    {
      "label": "P01 Life source time-scope supplement, printed pp5-9",
      "url": "https://github.com/15937-ass/ziwei-state-space/blob/9735cd7a78a3c0addcf93aad1730d775e691be40/knowledge/palaces/P01_life/wp05/LIFE_SOURCE_GAP_TIME_SCOPE_PP5_9_v0.1.json",
      "authority_status": "ACCEPTED_MAIN",
      "repository_path": "knowledge/palaces/P01_life/wp05/LIFE_SOURCE_GAP_TIME_SCOPE_PP5_9_v0.1.json",
      "blob_sha": "e8578e254559445860de5b3531bc429c9b5041c8"
    },
    {
      "label": "P01 Life shard state after source-gap closure",
      "url": "https://github.com/15937-ass/ziwei-state-space/blob/9735cd7a78a3c0addcf93aad1730d775e691be40/knowledge/states/P01_LIFE_STATE.yaml",
      "authority_status": "ACCEPTED_MAIN",
      "repository_path": "knowledge/states/P01_LIFE_STATE.yaml",
      "blob_sha": "796017ce20114fcf2f22a577b99bfda1dcd1733c",
      "note": "State cache reports the registered source-gap closure and cumulative record counts; live Issues/PRs remain execution truth."
    },
    {
      "label": "PR #577 — merged P01 Life source-gap closure",
      "url": "https://github.com/15937-ass/ziwei-state-space/pull/577",
      "authority_status": "MERGED_PR",
      "note": "Merged as commit 9735cd7a78a3c0addcf93aad1730d775e691be40. Its final-head quality gate reports full pytest, Node syntax check, P0 audit and governance validation passed; no Actions were invoked by this Sidecar task."
    }
  ],
  "authority_notes": "This is an accepted Knowledge-lane milestone. It closes the registered gap set, not the entire P01 source corpus; the P01 state names further source-first audit of historical candidates as next work. The Sidecar only records the milestone and does not modify Knowledge or Product.",
  "supersedes": [],
  "superseded_by": []
}
